REVIEW_ID,CUSTOMER_ID,OVERALL_RATING,REVIEW_TEXT,REVIEW_DATE,VERIFIED_PURCHASE,HELPFUL_VOTES
3233,518c4f9a-0498-4cf8-bfec-47f405dde2b0,4,Would recommend.,2024-02-04,true,8
3104,31996775-fa89-4f8f-9fdd-b6123d96d2a3,4,Not satisfied.,2024-05-13,true,4
7230,39aaabb3-4632-4aff-8750-0884fec35f10,3,"I wanted to like this jacket more, especially given the price point. After 3 months of use during my weekend flag football games and morning jogs, I have mixed feelings. The moisture-wicking works well enough - I stay fairly dry during moderate activity. The fit is decent through the shoulders and chest, though a bit loose around the waist. What concerns me is the durability. I've already noticed some wear at the cuff seams, and one of the zipper pulls feels loose. For the money spent, I expected better quality construction. On the positive side, it's handled the fall weather reasonably well, keeping me comfortable during those chilly morning workouts. The pockets are practical and well-placed. But considering there are similar jackets available for less, I'm not convinced the StormShield is worth the premium price. It gets the job done, but I'll probably look at other options when this one wears out. If you can find it on sale, it might be worth considering, but at full price, the value just isn't there for a budget-conscious buyer like myself.",2024-10-28,false,1
7147,983c7dd3-59ee-4023-83f0-13e65de6fcb3,3,Could go either way.,2024-01-08,true,0
4452,6166948a-4522-4b50-9aeb-46ed5f4c3bb8,4,"After a full year of regular use, these shorts have proven to be a solid value for my fitness needs. The material has held up well through countless gym sessions and weekend pickup games, with no signs of pilling or loose threads - impressive given how much I've worn them. The fit is comfortable without being too loose, and they stay in place during squats and runs. I especially appreciated the moisture-wicking during intense summer workouts; they dry quickly and don't get heavy with sweat. The elastic waistband has maintained its stretch, though I've noticed slight fading after multiple washes. The pockets are decently sized for basics like keys and a phone, but they could be a bit deeper. One minor issue is that the drawstring tends to get twisted inside the waistband after washing. For the price point, these shorts deliver good performance and durability. While not the fanciest athletic wear out there, they're reliable basics that get the job done without breaking the bank. Perfect for those of us who need practical workout gear that lasts.",2024-08-09,true,3
9062,324cd9e7-25a9-4f09-b9c8-57840bc38461,3,"Got this windbreaker hoping it would be a solid budget option for my morning runs and weekend pickup games. After six months of regular use, I have mixed feelings. The fit is decent - not too tight or loose - and it does block wind pretty well during those chilly fall morning workouts. The moisture-wicking isn't great though; I get pretty sweaty during intense activities and it doesn't breathe as well as I'd hoped. The main issue is durability. The zipper started catching after about 3 months, and there's already noticeable wear around the cuffs and collar. For the price point (around $65), I expected it to hold up better. You can find similar quality at sporting goods stores for $40-45. On the plus side, it packs down small enough to stuff in my gym bag, and the side pockets are actually useful. It works fine for light activities, but I wouldn't recommend it for serious training. If you're on a budget like me, you might want to wait for a sale or look at other options.",2024-09-03,true,10
9223,a62a9888-3218-49fe-8901-7509ae61d56d,3,"I wanted to love this windbreaker given the price point, but after 6 months of regular use, I'm feeling pretty mixed about it. The fit is decent - not too tight around the shoulders which is good for my weekend basketball games, and it does a fair job blocking wind during my morning runs. However, the zipper started catching after just a few weeks, and the cuffs are already showing wear despite careful washing. While it's lightweight and packs down small, which is convenient, the moisture-wicking isn't great when you really get moving. During intense workouts, I end up feeling pretty clammy. The worst part is how the water-resistant coating has already started to fade - definitely not what I expected at this price point. For winter activities, it's okay as a light layer but you'll need something more substantial when temperatures really drop. I've had cheaper jackets last longer. If you're on a budget like me, there are better options out there that'll give you more bang for your buck. It's not terrible, but I expected better durability and performance for what I paid.",2024-02-22,true,7
8626,2ed2667f-2385-4f21-bc04-4ab1707902fb,3,"After putting the Aeroswift Windbreaker through its paces during my fall CrossFit sessions and strength training, I have mixed feelings. The moisture-wicking capability is decent during moderate workouts, but during intense WODs, the fabric gets overwhelmed and starts to feel clammy, especially around the back and underarms. The lightweight construction is a plus for mobility during Olympic lifts and gymnastics movements. However, I'm concerned about durability. After just three months of regular use, the seams along the shoulders are showing early signs of wear, and there's already some pilling where the barbell makes contact during front rack positions. While the windbreaking properties are effective for outdoor training sessions, the zipper has become finicky and occasionally catches on the storm flap. For the price point, I expected better quality control and more robust construction. It's serviceable for casual training, but serious athletes might want to look elsewhere for gear that can withstand the demands of competitive CrossFit. The breathability and range of motion are there, but the durability issues make me hesitant to fully recommend it.",2024-09-07,true,11
2054,216968f9-c41e-45f4-b53e-9b8ec5dfa658,4,Don't recommend this. Not worth it.,2024-02-08,true,11
8526,cb5e65da-2e32-4ff4-9f1c-58f5b575b046,3,"I wanted to love the Aero One for my yoga and pilates sessions, especially since the sleek design and color options are totally on point with current athleisure trends. The fabric has this luxe feel that definitely makes a statement in my workout classes, and I've gotten several compliments on the aesthetic. However, I've found some limitations that are hard to overlook. While it's comfortable for low-impact activities, the fit becomes a bit restrictive during more dynamic movements, especially in my shoulders and hips. During winter, I had hoped it would provide more warmth for my outdoor runs, but I ended up needing to layer significantly. The material quality is decent, but after six months of wear, I've noticed some pilling in high-friction areas, which is disappointing given the price point. It works fine for my gentle yoga flows and casual gym sessions, but I expected more versatility from a premium athletic piece. If you're mainly focused on looking stylish during light workouts, this might work for you, but serious fitness enthusiasts might want to look elsewhere.",2024-01-08,false,10
4362,71ca9442-9bd9-47b9-aa0c-f64c282d0859,4,"After putting the VTX flex through intensive spring training sessions, I can confidently speak to its technical performance. The fabric composition delivers exceptional range of motion during complex compound lifts, and I've noticed no signs of wear despite multiple high-intensity sessions per week. During my recent marathon training, the compression zones provided adequate muscle support through long distances. However, the moisture management falls short of expectations, particularly during HIIT intervals. While the material claims advanced wicking properties, I experienced noticeable moisture retention around the chest and back during intense spring workouts when temperatures hit 70°F+. This affected my performance metrics, as I had to adjust my training intensity on particularly humid days. The durability is impressive - after 25+ hours of varied training, including barbell work, the seams and fabric show zero signs of stress or pilling. The anatomical fit remains precise even after multiple wash cycles. For serious athletes focused on performance data, this is a solid choice despite the suboptimal moisture handling. Would recommend primarily for strength training rather than cardio-intensive workouts.",2024-05-05,true,5
9704,cd85764a-3454-4eb9-bcf7-16207970bf5f,3,"As a dedicated marathon runner and strength trainer, I had high expectations for the Vortrex Athletics windbreaker. The moisture-wicking capabilities are decent during moderate training sessions, but it struggles to keep up during intense marathon preparation runs exceeding 15 miles. While the material initially felt promising, after 6 months of regular use, I've noticed some wear around the shoulder seams where my hydration pack sits. The technical performance is middle-of-the-road - it handles wind resistance well enough for tempo runs, but doesn't quite deliver the advanced moisture management I need when pushing my pace below 7-minute miles. The flexibility is adequate for strength training movements, though I've found the material bunches slightly during overhead presses. On the durability front, the zipper has maintained its integrity, but the reflective elements have started peeling after multiple washes. For the price point, I expected more refined performance features. It's serviceable for casual training days, but I reach for other options during competition prep and PR attempts.",2024-04-07,true,9
3036,c055961f-7eb4-4f49-8eba-66625e7bdc88,3,It's alright. Could be better.,2024-05-15,true,0
6508,26f2cdea-b715-49b9-92b8-2f41d562d4e4,3,Good value.,2024-09-20,true,0
9044,19dce3ad-7101-4c2e-8c0c-8e1da7de4bc4,2,"As someone training intensively for marathons and competing in CrossFit, I expected much more from this windbreaker. While the initial water resistance was adequate, after just two weeks of high-intensity training, the moisture-wicking capabilities severely degraded. During my HIIT sessions, I found myself completely soaked, with the fabric clinging uncomfortably and restricting movement. The seams are already showing wear at high-stress points, particularly around the shoulders and underarms - unacceptable for serious athletes putting in daily training hours. The zipper has become unreliable, frequently catching during dynamic movements. Most disappointing is the fabric's performance during morning runs; instead of wicking away sweat, it creates a greenhouse effect that seriously impacts my training intensity and recovery times. For the price point, the technical specifications promised much more than what was delivered. I cannot recommend this to anyone serious about their athletic performance, as it simply doesn't hold up to the rigorous demands of competitive training.",2024-03-16,true,14
9267,2f67e83d-854f-4e8c-bac7-a3cd85c11273,3,It's okay.,2024-04-10,true,1
7497,1dcecf46-176e-4571-8716-3b8edc44223f,3,"As someone who hits CrossFit WODs 5 times a week and takes strength training seriously, I had high expectations for this jacket. The moisture-wicking performance is decent during moderate workouts, but it struggles to keep up during intense metcons or heavy lifting sessions. After a year of regular use, the material has started pilling under the arms and where the barbell makes contact during Olympic lifts. While the flexibility is good enough for overhead movements and muscle-ups, the durability isn't what I'd expect at this price point. The zipper has held up well, and the fit remains true even after numerous washes. However, during particularly sweaty sessions, the fabric tends to get heavy and doesn't dry as quickly as some of my other technical gear. I've noticed some fraying around the cuffs where I wipe chalk off my hands. It's an okay jacket for general gym use, but serious athletes might want something more robust. For the investment, I expected better moisture management and durability, especially for CrossFit-specific movements.",2024-06-10,true,1
7963,0501630f-177c-4b64-8b6f-1e5c7b09c9e7,2,"As a dedicated marathon runner and strength trainer, I had high expectations for the Vortrex Athletics storm jacket, but it's fallen short in crucial areas. After three months of consistent use during my fall training sessions, the moisture-wicking capabilities are disappointingly inadequate. During intense strength workouts and long runs, the jacket becomes saturated and heavy, creating an uncomfortable clinging sensation that impacts my performance. More concerning is the durability issue. The seams along the shoulders have already started unraveling, likely from the regular motion during weight training. The zipper has also become unreliable, frequently catching and sometimes completely separating. For the premium price point, these quality issues are unacceptable. While the initial fit was good and the design seemed promising, the technical performance simply isn't there. As someone who trains year-round and needs gear that can keep up with rigorous workouts, this jacket just doesn't meet the standards required for serious athletes. I've had much better experiences with lower-priced alternatives that have lasted significantly longer.",2024-11-02,true,7
365,8ab02b33-4ff6-4939-9094-06ad774141cb,5,Forgettable.,2024-03-28,true,0
9874,8146febb-82b7-4abf-b062-206e3f5d3a66,3,"After a month of using this windbreaker for my morning jogs and weekend soccer games, I have mixed feelings. The fit is decent - not too tight around the shoulders and allows good range of motion. It does its job blocking wind during fall activities, and I appreciate the basic water resistance when caught in light rain. However, for the price point, I expected better quality. The zipper already shows signs of sticking, and I noticed some loose threads around the cuff seams after just a few washes. While the moisture-wicking works okay during light exercise, I get pretty sweaty during more intense activities since the breathability isn't great. The pocket design is practical with enough space for keys and phone, but the material feels thin compared to my previous windbreaker that cost less. It works fine for basic protection, but I'm concerned about long-term durability given what I'm seeing after just one month. If you catch it on sale, it might be worth considering, but at full price, there are better options out there for budget-conscious athletes.",2024-10-28,true,4
47,afac3d0f-1f54-45e5-9225-3dd3288d0fda,4,"After three months of regular use, these Vortrex sculpt pants have proven to be a solid investment, though not without a few minor issues. The moisture-wicking fabric really delivers during intense summer workouts and weekend tennis matches - I stay surprisingly dry even in humid conditions. The fit is generally comfortable, with good stretch that moves with you without losing shape. I especially appreciate how they've held up through multiple washes without pilling or fading, which is crucial since I'm not looking to replace workout gear every few months. While the price point is definitely on the higher end, the durability makes them more cost-effective than cheaper alternatives I've burned through. My only gripes are that the waistband could be slightly more secure during high-impact activities, and the pocket design could be more practical - my phone occasionally feels precarious during runs. For someone who exercises 4-5 times a week, these pants are a reliable choice. They're not perfect, but they get the job done and seem built to last, which matters more to me than trendy features or fancy branding.",2024-07-17,false,2
48,9d9bb610-6d04-4e5e-aa0b-251387681902,4,"After a full year of wearing the VTX Sculpt for my morning walks and weekend tennis matches, I can confidently say it's a reliable piece of athletic wear. The fabric has held up well through countless washes without pilling or losing shape - a big plus for someone who wants their clothes to last. The moisture-wicking feature really proves its worth during hot summer activities, keeping me reasonably dry even during intense matches. The fit is comfortable and practical, though not as fancy as some premium brands charging twice the price. I appreciate that it doesn't have unnecessary bells and whistles that drive up the cost. The simple design works well for my needs, whether I'm doing light exercises at home or meeting friends for a game of tennis. My only gripe is that the seams around the shoulders could be more reinforced - I've noticed some minor wear there. That said, for the price point, it delivers good value. It's refreshing to find athletic wear that focuses on the basics without trying to be overly trendy or expensive. A sensible choice for active retirees who want function over fashion.",2024-06-20,true,10
6804,0036419e-fcfe-46ad-aff8-1354d64fbdd0,3,"After a full year of testing this jacket through intense marathon training, I have mixed feelings. The moisture-wicking capabilities are adequate during moderate runs, but once you hit those high-intensity threshold sessions, the fabric becomes overwhelmed and starts to retain sweat, particularly around the shoulders and back. I've logged over 500 miles in this piece, and while the main body has held up reasonably well, the seams along the shoulders are showing early signs of wear – not what I expect from performance gear at this price point. The jacket performs best during fall tempo runs in 45-55°F conditions, providing decent temperature regulation. However, the fabric doesn't maintain its technical properties after repeated washing cycles, which is crucial for gear that sees heavy use during marathon prep. The flexibility is there, allowing for full range of motion during strength training sessions, but the moisture management issues have impacted some of my interval workouts, forcing me to adjust my training intensity on humid days. For casual runners, this might suffice, but for those of us tracking every performance metric and pushing our limits, there are better options available.",2024-10-28,true,2
50,c5e97e2a-f40e-45cd-8a16-9d84e65b9487,4,"After putting these leggings through their paces in multiple CrossFit WODs and HIIT sessions, I'm genuinely impressed with their technical performance. The moisture-wicking capability is exceptional - even during my most intense box jumps and burpee sequences, the fabric stays remarkably dry and comfortable. The compression is well-balanced, offering muscular support without restricting movement during Olympic lifts. The durability has held up impressively through rope climbs and barbell work, with no signs of pilling or wear after a month of heavy use. The only minor issue I've encountered is that the waistband tends to slide down slightly during running segments, requiring occasional adjustments. What really stands out is the fabric's flexibility during dynamic movements - no restriction during deep squats or box jumps. The seam construction shows attention to detail, with reinforced stitching in high-stress areas. For serious athletes focused on performance, these leggings deliver on most fronts. While the waistband could be more secure, the technical features make these a solid choice for high-intensity training.",2024-02-20,true,0
8929,3b8d7f44-d1d8-4e82-af06-10d05850be53,3,Good stuff.,2024-10-11,true,6
6856,ed066351-661e-4f8a-a034-fb05ca12806c,4,Good buy.,2024-02-27,true,0
4519,b546e72a-bfb9-46e1-80bf-ebcaed318292,4,I'm pleased with this. Good buy.,2024-10-22,true,12
3706,d2f48338-194a-4ded-bd3a-f74da0226c5a,4,Not good.,2024-06-16,true,12
57,1c466a96-1d90-423f-8303-a07da7db209a,4,"Really pleased with these VTX sculpts for my daily walks and gentle stretching routines. The fabric feels soft against my skin and moves well with my body during light exercise. I especially love how they don't restrict my movement when I'm doing my morning yoga stretches. The fit is generally comfortable, though I've noticed the waistband tends to roll down a bit during my longer walks, which can be a bit bothersome. While the design is attractive and the pants feel well-made overall, I do wish they were a bit more breathable. On warmer days, I find myself getting somewhat uncomfortable, especially during my afternoon garden walks. After two weeks of regular wear and washing, I've also noticed the elastic in the waistband starting to lose some of its firmness, which concerns me for long-term use. Despite these minor issues, they work well for my relaxed lifestyle and moderate exercise routine. They're a good value for the price, especially compared to pricier brands I've tried. Would recommend for fellow light exercise enthusiasts, just size down if you're worried about the waistband staying put.",2024-09-04,true,13
3667,3df2ab59-ba44-4888-83d3-1d55c5c2f9e5,4,"These shorts have become my go-to for my evening walks and casual weekend activities. The liteflex material feels incredibly soft against the skin, and I particularly appreciate how they don't bunch up or restrict movement when I'm out for my stress-relieving walks. During the summer months, the breathability really shines - I stayed surprisingly cool even during humid days. While the comfort level is excellent, I've noticed some minor pilling after washing, which is why I save these mainly for my workout sessions rather than everyday wear. The fit is generally good, though the waistband could be slightly more forgiving after a big meal. That said, the four-way stretch moves naturally with my body, making these perfect for my moderate-paced activities. What I really love is how these shorts help me transition from a hectic workday to my peaceful evening routine. The lightweight feel and moisture-wicking properties make them ideal for those warm summer evenings when I need to decompress with a long walk around the neighborhood.",2024-06-03,true,13
63,63c25bc0-93e5-4c78-b810-e958ed2c371f,4,"As a dedicated marathon runner, I've put these vtx leggings through serious mileage over the past year. The durability is impressive - no pilling or wear despite intense training sessions and long-distance runs. The compression maintains its effectiveness even after multiple washes, which is crucial for muscle support during my strength training days. However, the moisture-wicking performance leaves room for improvement. During my spring marathon training, particularly on humid mornings, I noticed some moisture retention around the knee and hip areas after about hour two. This wasn't a deal-breaker, but it's noticeable compared to some premium competitors in the market. The flexibility is excellent, allowing full range of motion for deep squats and dynamic stretches. The technical construction, especially the flatlock seams and reinforced stress points, shows attention to performance details. While not perfect in terms of moisture management, these leggings have become a reliable piece in my training arsenal, especially for cooler weather sessions where sweat management is less critical.",2024-05-10,false,0
7381,5b9a0aa9-6f75-4aaf-a5a4-fc95368693b8,3,Waste of money.,2024-11-16,false,0
9823,1d124059-b083-403b-99c6-330c6c34b439,3,"After a month of using the AeroSwift Wind jacket for my weekend activities, I have mixed feelings. The fit is decent - not too tight or loose, and it does block wind pretty well during my morning jogs. However, for the price point, I expected better quality. The seams near the shoulders started showing wear after just a few washes, which is concerning for long-term durability. While it's comfortable enough for light exercise, the moisture-wicking isn't great - I found myself getting pretty sweaty during more intense workouts. I appreciate that it's lightweight and packs easily into my gym bag, but there are similar jackets available for less money that probably do just as good a job. Used it throughout December for outdoor sports and walking, and while it provided some warmth, I needed to layer up more than expected. The zipper is a bit finicky too, sometimes catching on the fabric. Bottom line: it works okay for basic activities, but the price doesn't match the quality. If you're watching your budget like me, you might want to look for something more cost-effective.",2024-12-23,true,0
8727,352eb76c-d2d1-4abd-80b4-7bbf550fdf77,3,"I wanted to love the AeroSwift leggings from Vortrex Athletics - the sleek design and premium branding really caught my eye for my morning pilates sessions. The fabric has a luxurious feel and the metallic accents are quite chic. However, I'm finding the fit somewhat disappointing, especially around the waist where it tends to roll down during more dynamic movements. While the material is adequately warm for winter studio workouts, it creates unflattering lines across the hips that I wasn't expecting from a premium brand. On the positive side, the moisture-wicking feature works well during my boutique fitness classes, and I appreciate the thoughtful pocket placement. The color options are sophisticated and pair beautifully with my designer athletic wear collection. That said, for the price point, I expected better compression and a more flattering silhouette. The seams, while stylish, create pressure points during certain poses. I might keep these for casual gym days, but they won't be my go-to for my more intensive pilates sessions where I need both style and performance.",2024-01-24,true,6
